{"acceptanceCriteria":["TokenBucket encapsula tokens, maxTokens, rateBitsPerMs e lastUpdate.","update e consume exigem tempo monotônico.","obterEstadoBitmask retorna 0, 1, 2 ou 3 correspondendo aos bits de vazio e refil ativo.","src/index.ts re-exporta TokenBucket e obterEstadoBitmask."],"architecture":{"policyDigest":"ffba54564e1c13c723801c41d4c68a6599dbc6328556250a8290f994c14d0d65","ruleAssessments":[{"evidence":"Falhas em argumentos e limites disparam RangeError explicitamente; falhas de saldo em consume retornam false sem mutação indevida.","ruleId":"ARCH-FAILURE-EXPLICIT","sourceUnitIds":["UNIT-0001"],"verdict":"APPLIED"},{"evidence":"Tempo recebido por parâmetro explícito monotônico bigint com fallback padronizado.","ruleId":"ARCH-DETERMINISTIC-TIME","sourceUnitIds":["UNIT-0001"],"verdict":"APPLIED"}]},"changeKind":"PRODUCT","failureSemantics":[{"id":"FAIL-0001","observableOutcome":"Disparo síncrono de RangeError preservando o estado","trigger":"Entradas numéricas negativas, taxa não inteira ou tempo regressivo"}],"inputCoverage":[{"disposition":"REQUIREMENT","rationale":"mapped_by_semantic_compiler","requirementIds":["REQ-0001","REQ-0002","REQ-0003","REQ-0004","REQ-0005"],"unitId":"UNIT-0001"}],"intent":"Implementar TokenBucket com controle temporal determinístico e obterEstadoBitmask exportados em src/index.ts.","normalizedDemandDigest":"698af60acbb87d36f6f6f9b4087b6d1f34b3f294983bda03454eeadc5a4bfb8e","requirements":[{"id":"REQ-0001","provenance":"USER","statement":"TokenBucket aceita (maxBytes: bigint, mbps: number, initialTime: bigint) e converte para taxa rateBitsPerMs (mbps * 8000) e capacidade maxTokens (maxBytes * 8n)."},{"id":"REQ-0002","provenance":"USER","statement":"update(now: bigint) acumula timeDiff * rateBitsPerMs limitando ao teto maxTokens de forma monotônica."},{"id":"REQ-0003","provenance":"USER","statement":"consume(bits: bigint, now: bigint) atualiza saldo via update e deduz tokens se disponível, retornando boolean."},{"id":"REQ-0004","provenance":"USER","statement":"obterEstadoBitmask(bucket: TokenBucket): number retorna bit 0 se tokens == 0n e bit 1 se taxa de refil > 0n."},{"id":"REQ-0005","provenance":"USER","statement":"src/index.ts re-exporta TokenBucket e obterEstadoBitmask."}],"schema":"aegis.clarified_demand.v2","scope":{"excluded":[],"included":["src/tokenBucket.ts","src/tokenBucket.proof.ts","src/index.ts","src/.aegis/clarified-demand.json","src/.aegis/contract-ir.json","src/.aegis/proof-registry.json"]}}
